,0
0,"Both reading and debate on four days employees, compony more profites,decriese country employment rate and better employ life styles on the article, notwithstanding the lecture rejected all topics."
1,"

The author strongly proposes which four days employees have less cost to compony so compony can make more profites."
2," However the change would not effect the profite or increase const of compony by adding more employees compony should by more computers and need more space, the speaker effectively casts doubton the author issues argument."
3,"

The writter opinens that we have reduce unemployment number on country which more employment which have less cost to company becuase less pay to employ."
4, similar the less cost argument the orator weakens this argument by compony may rasie they excptions and force employees work overtimes that counter the topic.
5,"

Finally, we have the better employees life style argument, and the lecture informs us that more free time have bad result to empolys the be come less royals to thier jobs, which we can counter by chance to lose thier jobs become more."
6, This infomation directly limits the author's reasoning that empolyees have more time to spend with thier families.
7,"

Due to the effective contradicting of the arguments doubt exisits within the authors presention."
8,"

There is no shortage of opinions on always telling the truth is first piorety in any relationships."
9," If I were forced to choose, In my viewpoint, I believe the truth is most important consideration in all kind of relationships."
10," I feel this way for two main reasons, the truth came trust in peoples connection and saying truth show your self confident."
11,"

First of all, when always you say truth people know your words became invalid it is imposible so people always have a trust on you so your relations become greater."
12, My personal experience is a great example of this.
13, I working for a I.
14,T company as a developer after a while when company needs to choose new team mananger between developers CEO chooses me for this poistion after that I asked Why you choose me for this position from CEO his answer was you had enogh skills and so important I can trust you.
15," For this reason, I say the truth is builder of trust in relations."
16,"

Secondly, at the moment you scarde form somthing or somebody you lies ;However saying truth showes your having self confident and brave."
17," Drawing from my own experience, When was going to schools one day I did not do my homeworks and my teacher was so strice and she punished the students that did not done their howeworks I had two options on this day do not go school and force my mom to call school and say I am sick, secondly go school and take my punishment."
18, that day I choose was second choice.
19, My teacher tells my mothers your kid is brave my mother ask her why you say this opinien about my child her answer was I has no afried of tells truth about his bad action and take the punishments.
20, It is certainly clear to see when you sayes truth you have self confident.
21,"

In coclution, Saying truth is so important to all kind of relations."
22, this is because help you to gian people trust and show you have enogh brave to say the truth at all moments.
23,"

According to the author, dinosaurs are endotherms."
24," But, the speaker contradicts these claims based on Polar was warmer that today, a dinosaurs legs position showes he had highly enregy to running and haversin canals show their growing be slow on cloud part of years."
25,"

The author strongly proposes that Polar dinosaurs was endotherms becasue on polar weather only endotherms animals can survive."
26," However, The dinasours's time polar was so warm than today and dinasours can migrate form could area to warmer, speaker effectively  casts doubt on the author issue argument."
27,"

The writer opines that dinosaurs legs connection with bodies shows their able to physical activity, but running effectient on endotherms animals."
28," The speaker similar Polar dinasaurs was endotherms argument, the orator weakens this subject by this activity shows dinasours have high energy and the body sructure show dinasours's heavy weghit that counter the issue."
29,"

Finally, we have the haversian canals on bones, and the lecture informs us that dinasours had changes on their growing speed that was faster on warm weather condition and slower on cold weathers, which we can counter by endotherms growing has unchanged by weather changes."
30, This infomration directly limits the author's reasoning that harversian canals show they grow quickly.
31,"

Due to the effective contradicting of the arguments, doubt exists within the author's presentation."
32,"

Both reading and listening debate on the online encyclopedias pons and cons, the online encyclopedias's writers academic credentials, could be hack or edit by none trusted user and only have popular topics in article."
33," Notwithstanding, the lecture rejected all topics."
34,"

The author strongly proposes that the writers have no academic credentials so the aricles on online enyclopedias be inaccurate in many cases."
35," However, the problem exists on the old encyclopedias too, speaker effectively casts doubt on author's issue argument."
36,"

The writer opines that online system can hack to delete or edit, or on encyclopedias spisificte can be edit by intrust or inaccuret user."
37," The similar the writers have no academic clams argument, the orator weakens this subject by the online encyclopedias sould have protected article so a limited trusted users have access to edit it."
38, that counter the the issue.
39,"

In final stroke, the essayist suggests the online encyclopedias only have focus on popular topics, that creates a false consept of what is important or not."
40," The speaker diverges forms this viewpoint by highighting that this issue exist on old encyclopedias too, and online encyclopedias have academic subject."
41,"With the online encyclopedias have unlimited space so their can have how unlimited articles, the ssayist suggestion must be incorrect."
42,"

Due to the effective contradiciting of the arguments, doubt exisits within the author's presentation."
43,"

There is no shortage of opinions on our grandparents childerhood life were harder or not than our life."
44," If I were forced to choose, In my viewpoint, I belive that our life were too esay thar our perviers generation."
45," I feel this way for two main reasons,more people have modest level of well-bing and the new techlongies helps people which I will explore in the following paragraphs."
46,"

First of all, more people have minimum level of well-bing on last 21 cenetry."
47," they have easier access to clean water, hospital, musiem and school."
48, My grandpa experience is a great example of this.
49, he told us his sister died because his rular river become unfoul and it had a deasies althoght that happend because other vilagers wash a died body on the river at night time.
50," for this reason, our generation has more well-bing and comfortable life."
51,"

Secondly, tech and sience have bigger influnce on our lifes and life-style."
52, you can see the changes on every topic like how we buy things or how people connect to eche other.
53, every seconds have a new change to make our live easier.
54," Drawing form my own experience, when I wanted to call somebody on 2008 I had only one opiton phone call; however I have telegram or other internet base chat app to call my firends now, moreover I have better connection we can see eche face and video call them."
55, It is certainly clear to see how much techlongy changes our life that on the way to become easy.
56,"

In conclusion, our life is much more easy that our old generation."
57,moreover I think our next genration life become much more easier than our.
58, this is because more tech adevence and minimum level of wellbing become higher.
59,"

According to the author buzzing is a harmful advertiment method."
60," However, the speaker contradicts these claims based on buzzers lay about the product, people cannot ask question from buzzers, and this method harms social relationships."
61,"

The author strongly proposes that buzzers lay about the product; they make profit with advertising, so they have perpose to say lay about the product."
62," However, a company hairs buzzers whose use the product and have satisfaction about it; the speaker effectively casts doubt on the author's issue argument."
63,"

The writer opines that people cannot ask question from buzzers, which buzzers have no mark to tell they make advertiment about a  product, so they do not ask any question."
64, Similar to buzzers lay about the product argument.
65," the orator weakens this subject by people ask many questions such as how long you use the product, and buzzers should answer the questions that counter the issue."
66,"

The essayist suggests buzzing advertisment has negetive effect on social relationships that people cannot trust each others, because they do not know who has motivtion to advertiment or is a real user of the product."
67," The speaker diverges from this viewpoint by highlighting that the company cannot hair buzzers because they are a person in social, the essayist's suggestion must be incorrect."
68,"

According to the author, the yellow cedar trees have been decrease poplation since 19 century."
69," But, the speaker contradicts these claims based on insect attaking the stem of trees, breas clawing and eating them, and climate change appered this effect."
70,"

The author strongly proposes that insect attacks on tree casing this trees declinig."
71, the insect's larve eats the stem of tree so they damage the tree.
72," However, the healthy trees have a lot more insects like cedar bark beetle because they have a poisen that help trees to be safer, the speaker effectively casts doubt on the author's issue argument."
73,"

The wirter opines that breas help to kill trees, which they claw to tree and eat yellow cedar trees as the yellow cedar trees contain suger."
74," Similar to insect attacking trees argument, the orator weakens this subject by trees died on all locations of north america however the inland has any breas so why this happend in the inland too."
75,that counter the issue.
76,"

In a final stroke, the orator cites many trees find deads on high tempeatures on low altidtute and root of other trees has same condition but they stay live thereby dismisses the author's argument for the climate changes casing trees deading and  the root systems damaged by day and night temperatures changes."
77, th strength of the author argument depletes.
78,"

There is no shortage of opinions on the number one piority to do your job in today's world."
79," If I were forced to choose, In my viewpoint, I believe working slowly and perfect is more important."
80," I feel this way for two main reasons, you can think about the way you done the work and will not get bug or mistake in feture which I will explore in the following paragraphs."
81,"

Fisrt of all, the way you done the job is so important as your way be bad you will catch so much truble in the way, but if be good you will have esay time."
82, My personal experience is a great example of this.
83, I am a computer developer on IoT industry.
84," When I get new task, I sepend 40 percent of time to think how I should code the task and read on internet other the person approches."
85, usuially  I done my job so easy and dont need to change my approch at time coding the task.
86," For this reason, I will perfer others to do samething and before doing something thinks about it."
87,"

Secondly,  sometimes when you do a mistake case a big loses ,so why you do your work that you know you have a mistake."
88, I do not talk about a lot of mistake only a mistake has a possibilty to take one person life.
89, Drawing from one story I read longtime ago.
90, In a city a drugstore manager was so lazy and he did not wrote the name of drugs on their labels.
91, Onday he went to a trip and put his son on charge of store.
92, after he came back the police visted the drugstore and told him he killed a person because sold him incorrect drugs and he goes to jail.
93, It is certainly clear to see why you shoud done your job perfect because some mistakes have magnifient lose.
94,"

In conlusion, working slowly and make sure all things is okay, it is better way to do your work."
95, This is because the mistake consequest and you done the job so easy.
96,"

According to the author, the yellow cedar trees have been decrease poplation since 19 century."
97," But, the speaker contradicts these claims based on insect attaking the stem of trees, breas clawing and eating them, and climate change appered this effect."
98,"

The author strongly proposes that insect attacks on tree casing this trees declinig."
99, the insect's larve eats the stem of tree so they damage the tree.
100," However, the healthy trees have a lot more insects like cedar bark beetle because they have a poisen that help trees to be safer, the speaker effectively casts doubt on the author's issue argument."
101,"

The wirter opines that breas help to kill trees, which they claw to tree and eat yellow cedar trees as the yellow cedar trees contain suger."
102," Similar to insect attacking trees argument, the orator weakens this subject by trees died on all locations of north america however the inland has any breas so why this happend in the inland too."
103,that counter the issue.
104,"

In a final stroke, the orator cites many trees find deads on high tempeatures on low altidtute and root of other trees has same condition but they stay live thereby dismisses the author's argument for the climate changes casing trees deading and  the root systems damaged by day and night temperatures changes."
105, th strength of the author argument depletes.
106,"

There is no shortage of opinions on the number one piority to do your job in today's world."
107," If I were forced to choose, In my viewpoint, I believe working slowly and perfect is more important."
108," I feel this way for two main reasons, you can think about the way you done the work and will not get bug or mistake in feture which I will explore in the following paragraphs."
109,"

Fisrt of all, the way you done the job is so important as your way be bad you will catch so much truble in the way, but if be good you will have esay time."
110, My personal experience is a great example of this.
111, I am a computer developer on IoT industry.
112," When I get new task, I sepend 40 percent of time to think how I should code the task and read on internet other the person approches."
113, usuially  I done my job so easy and dont need to change my approch at time coding the task.
114," For this reason, I will perfer others to do samething and before doing something thinks about it."
115,"

Secondly,  sometimes when you do a mistake case a big loses ,so why you do your work that you know you have a mistake."
116, I do not talk about a lot of mistake only a mistake has a possibilty to take one person life.
117, Drawing from one story I read longtime ago.
118, In a city a drugstore manager was so lazy and he did not wrote the name of drugs on their labels.
119, Onday he went to a trip and put his son on charge of store.
120, after he came back the police visted the drugstore and told him he killed a person because sold him incorrect drugs and he goes to jail.
121, It is certainly clear to see why you shoud done your job perfect because some mistakes have magnifient lose.
122,"

In conlusion, working slowly and make sure all things is okay, it is better way to do your work."
123, This is because the mistake consequest and you done the job so easy.
124,"

According to the author, edmontosaurus migrate to hospiatable regions in the south on winter."
125," But the specker contradicts this clamis base on the edmontosaur’s diet, many edmontosaur fossils have been found from the same site, and physically capable of a long distances trip."
126,"

The author strongly proposes that edmontosaur’s diet proves the migration porposial because it, only, eats plants."
127, plants can not grow during the Alaska's North Slope.
128," However, the sunshine has changed since edmontosaur’s years and in those years, in summer the Alaska's North Slope had full sunshine during summer, which plants could grow better so edmontosaur could eat dead plants in winter, specker effectively casts doubt on the author's issue argument."
129,"

The writer opinens that many edmontosaur fossiles have been found in the same site so they lived in groups like many modern migratory animals."
130," Similar to edmontosaur’s diet argument, the orator weakens this subject by other modern animals live in other places have the same herds system and they do not migrate that counter te issue."
131,"

The essayist suggests adult edmontosaur's bodies were support of long distance trip that bodeis capable to run with speed of 45 kilometers per hour."
132,"  The specker diverges from this viewpoint by highlighting that adult bodies had this capablity and young edmontosaur had not this power, the essayist's suggestion must be incorrect."
133,"

According to the author, patients' medical records should keep in electronic databases which has many advantages over the paper-based system."
134," At the same time, the speaker denies these benefits based on saving money, less human error, helping medical research."
135,"

The author strongly proposes that this new system cause less money over than the old system because the new system can free up storage rooms which store papers of patients' medical records."
136," Also, it has essaier access to a patient's records and can save the transport cost."
137," However, a doctor should keep the paper records which needs in a legal prosses, the speaker effectively casts doubt on the author's issue argument."
138,"

The writer opines that the electronic system has less error which pervents the unreadable doctor's handwriting."
139," Moreover, it has a standard records system which has more organization than the paper-base system."
140," Similar to the saving money argument, the orator weakens this subject by doctors use the paper-base system for taking notes and the office staff write the doctor handwriting to a computer, that counters the issue."
141,"

The essayist suggests the new system aids medical research which researchers can use from this records on their researchs."
142," The speaker diverges from this viewpoint by highlighting that the law stops access to these records and reaserchers must get permission for it from the patient, the essayist's suggestion must be incorrect."
143,"

Over the past few years, busy and over working parents have become more than earlier because parents want to make a great life for their children."
144, Many overworking parents today still have mixed views on whether they should do fun and enjoy their time or do schoolworks or check their children workouts in their little free time.
145," In my personal view, I strongly like do have fun time or chill with the kid beside than schoolworks and check the kid's homework."
146, I feel this way for two main reasons which I will explore in the following essay.
147,"

To begin with, children need a strong connection with thier parents, at the same time, busy parents which have a limited time to spend with their children, could not make their relation with their children strong enough."
148," Moreover, after a long time, children will see their parents as a coworker which is a bad view for a child."
149," Playing and have fun with anybody could make a good relation in a short period, so overworking parents can play and have good time with their children to make a strong relationship and fill their empty place."
150,"

On top of that, their parents have less possiblelty to do a craime or a inlegal action."
151,"

To make a long story short, busy parents should focus their children have nice time and enjoy it rather than do their homeworks in their little free time."
152," This is because the children will have a stronger connection to their parents, and the children may do craime less."
153,"

Over the past few years, workers unioun have got more power to defence workers' right which helps workers and their families have a better life."
154, Many workers today still have mixed views on whether they have a better day if they have many not same shapes of jobs to do during a workday or have similar tasks all days.
155," In my personal view, I strongly agree with this statement, when workers have different types of task to do in a day, they are more satisfied and happier."
156," I feel this way for two main reasons, which I will explore in the following essay."
157,"

To begin with, different shapes of jobs create a uniqe person during the workday because any workers have a uniqe issue to do in a workday which make all workers different than other workers."
158," Moreover, it is possilbe that a worker did the same task many years ago and a new worker can talk to him or her to gain the worker experiece and make a friendship which is better to workers cominiuty and connection."
159," As a result, workers have better day at the work when they do more different types of tasks during the workday."
160,"

On top of that, workers gian more varied experience when do different types of tasks which help them to have a better carrer path."
161, A person starts working with the dream of become better and after time become a manager of his or her section.
162, To become a manager the person should have many experiece which made by doing different tasks and shapes of tasks.
163," However, doing similar tasks do not give them the option to make vaired knowledge."
164," It is clear to see a reason why, workers are more satisfied when have many different types of jobs than to do the same types of jobs during the workday."
165,"

To make a long story short, workers have better day when they have varied jobs type to do during the workday."
166," This is because different tasks' types make them a uniqe person, and they gain more experience in vaired tasks' types."
167,"

Nowaday, people have more jobs and their jobs become complex and harsh to do."
168, People today still have mixed view on they do not alot things well because they have so many different things.
169," In my personal view, when people have many task to do, they can not do things well."
170," I feel this way for two main reasons, which I will explore in the following essay."
171,"

To begin with, when a person has many tasks, his/her foucs decrease."
172, This because of his/her mind can not be complete free and  think about a job.
173," however when a person has a task, his/her mind can only think about the task."
174, he/she can think about all of details and viewpoints of the task.
175," As a result, the person can do a thing very good."
176," For example, a professor has degree about on field of sience."
177, the professor teach only his/her field at university.
178," 

On top of that, when a person has to many things, he/she does has enoegh time."
179," Therefore, a task needs time to pay attation and solve the task, so a person has limited time on day and he/she must do all tasks."
180,However a person with one job has time to think and can foucs on the task.
181," As a result, he/she do the task with out a problem."
182," For instance, a enginer can solve a problem about mathmatic ont 

To sum up, People can not do many tasks well because they have many jobs."
183," This is because they lose their focus on a task, and they do not have enogh time for a task."
184,"

Over the past few years, new systems like cell phone become popular in young children and they should learn how to work with them."
185, Many teachers still have mixed views on whether new techlonogy make their job more harder than past or not.
186," In my personal view, I strongly disagree with this statement, new systems, such as social neworking apps and web sites help students to learn easier than past times and spending time with them helps them to have more inforamtion."
187," I feel this way for two main reasons, which I will explore in the following essay."
188,"

To begin with, new techlonogy helps children to learn better an easier because these systems opened new ways to teach kids like videos and learning games, which help students to learn and parctice subjects without any teacher, only a app assists and teaches them."
189," It is clear to see a reason why kids have time with these new tech, learn easier than past children."
190," For example, my young brother learn germany from an app without any class and teacher in the same time he shoud spend in class to learn a new language."
191," 

On top of that, on eailer time was other things that gain kids foucs like palying in street with other friends."
192," At the same time, many men and women learn and study because they controled the play time perido and studied more."
193," It is the same system for today kids, they should manage the play time span and have control on time peride in social networking apps."
194," For instance, my mother always siad she and her firends plaied games on streets in summer however me and my friends playing online games in summer and both have control on playing time duration."
195,"

To make a long story short, today, teaching children is easy task because they have time with new systems."
196," This is because they learn many things form new systems, and in past time, their was other items that children played with them."
197,"

According to the author, edmontosaurus migrate to hospiatable regions in the south on winter."
