,0
198," But the specker contradicts this clamis base on the edmontosaur’s diet, many edmontosaur fossils have been found from the same site, and physically capable of a long distances trip."
199,"

The author strongly proposes that edmontosaur’s diet proves the migration porposial because it, only, eats plants."
200, plants can not grow during the Alaska's North Slope.
201," However, the sunshine has changed since edmontosaur’s years and in those years, in summer the Alaska's North Slope had full sunshine during summer, which plants could grow better so edmontosaur could eat dead plants in winter, specker effectively casts doubt on the author's issue argument."
202,"

The writer opinens that many edmontosaur fossiles have been found in the same site so they lived in groups like many modern migratory animals."
203," Similar to edmontosaur’s diet argument, the orator weakens this subject by other modern animals live in other places have the same herds system and they do not migrate that counter te issue."
204,"

The essayist suggests adult edmontosaur's bodies were support of long distance trip that bodeis capable to run with speed of 45 kilometers per hour."
205,"  The specker diverges from this viewpoint by highlighting that adult bodies had this capablity and young edmontosaur had not this power, the essayist's suggestion must be incorrect."
206,"

According to the author, the yellow cedar trees have been decrease poplation since 19 century."
207," But, the speaker contradicts these claims based on insect attaking the stem of trees, breas clawing and eating them, and climate change appered this effect."
208,"

The author strongly proposes that insect attacks on tree casing this trees declinig."
209, the insect's larve eats the stem of tree so they damage the tree.
210," However, the healthy trees have a lot more insects like cedar bark beetle because they have a poisen that help trees to be safer, the speaker effectively casts doubt on the author's issue argument."
211,"

The wirter opines that breas help to kill trees, which they claw to tree and eat yellow cedar trees as the yellow cedar trees contain suger."
212," Similar to insect attacking trees argument, the orator weakens this subject by trees died on all locations of north america however the inland has any breas so why this happend in the inland too."
213,that counter the issue.
214,"

In a final stroke, the orator cites many trees find deads on high tempeatures on low altidtute and root of other trees has same condition but they stay live thereby dismisses the author's argument for the climate changes casing trees deading and  the root systems damaged by day and night temperatures changes."
215, th strength of the author argument depletes.
216,"

There is no shortage of opinions on the number one piority to do your job in today's world."
217," If I were forced to choose, In my viewpoint, I believe working slowly and perfect is more important."
218," I feel this way for two main reasons, you can think about the way you done the work and will not get bug or mistake in feture which I will explore in the following paragraphs."
219,"

Fisrt of all, the way you done the job is so important as your way be bad you will catch so much truble in the way, but if be good you will have esay time."
220, My personal experience is a great example of this.
221, I am a computer developer on IoT industry.
222," When I get new task, I sepend 40 percent of time to think how I should code the task and read on internet other the person approches."
223, usuially  I done my job so easy and dont need to change my approch at time coding the task.
224," For this reason, I will perfer others to do samething and before doing something thinks about it."
225,"

Secondly,  sometimes when you do a mistake case a big loses ,so why you do your work that you know you have a mistake."
226, I do not talk about a lot of mistake only a mistake has a possibilty to take one person life.
227, Drawing from one story I read longtime ago.
228, In a city a drugstore manager was so lazy and he did not wrote the name of drugs on their labels.
229, Onday he went to a trip and put his son on charge of store.
230, after he came back the police visted the drugstore and told him he killed a person because sold him incorrect drugs and he goes to jail.
231, It is certainly clear to see why you shoud done your job perfect because some mistakes have magnifient lose.
232,"

In conlusion, working slowly and make sure all things is okay, it is better way to do your work."
233, This is because the mistake consequest and you done the job so easy.
234,"

Over the past few years, new systems like cell phone become popular in young children and they should learn how to work with them."
235, Many teachers still have mixed views on whether new techlonogy make their job more harder than past or not.
236," In my personal view, I strongly disagree with this statement, new systems, such as social neworking apps and web sites help students to learn easier than past times and spending time with them helps them to have more inforamtion."
237," I feel this way for two main reasons, which I will explore in the following essay."
238,"

To begin with, new techlonogy helps children to learn better an easier because these systems opened new ways to teach kids like videos and learning games, which help students to learn and parctice subjects without any teacher, only a app assists and teaches them."
239," It is clear to see a reason why kids have time with these new tech, learn easier than past children."
240," For example, my young brother learn germany from an app without any class and teacher in the same time he shoud spend in class to learn a new language."
241," 

On top of that, on eailer time was other things that gain kids foucs like palying in street with other friends."
242," At the same time, many men and women learn and study because they controled the play time perido and studied more."
243," It is the same system for today kids, they should manage the play time span and have control on time peride in social networking apps."
244," For instance, my mother always siad she and her firends plaied games on streets in summer however me and my friends playing online games in summer and both have control on playing time duration."
245,"

To make a long story short, today, teaching children is easy task because they have time with new systems."
246," This is because they learn many things form new systems, and in past time, their was other items that children played with them."
247,"



Discipline and punctuality are two qualities that every human being should have."
248," Many think that it is a job of parents to teach children how to be a good citizen of society, whereas others think that they should learn it from school."
249," I agree with the first thought and in this, essay I will present my arguments and provide my opinion."
250,"



It may vary depending upon the nature of the data but, in general, 0."
251,7 - 0.
252,9 is considered a high correlation.
253,"

Firstly, children spend a majority of their time at home with their parents."
254, So the influence of parents will be much more on them.
255," So it is the job of guardians to teach them and make them aware with a concept of respect, to every fellow citizen in the society."
256," For example, they should provide a role model in their life or they can become a role model for them and provide them with a comfortable environment to learn, to respect each other."
257," Secondly, parents should also teach their children about their duties towards society, it helps them to build a character."
258," For instance, parents should encourage kids to participate voluntarily in social work and community services."
259," Last but not least, money management is also a quality which should be taught them by their guardian as it helps them in their in the budget in future."
260,"

On the other hand, teachers also play an important role in every student’s life."
261," It is impossible for kids to learn each and every aspect of life from their folks, in such cases teachers should come and play their role."
262," For example, school is the best place to teach the value of discipline as it is a hard quality for parents to teach their kids."
263, Discipline not only helps each individual but in general it helps to develop a better nation as each citizen are aware of their duty and role in the society.
264," In addition, punctuality and time management are two important aspects of life."
265, These two virtues should be taught to students by their teachers.
266," In such case, teachers should give them some task to complete within a limited time and who gets succeeded in completing them within a time limit, they should be rewarded and make them a role model for others."
267,"

To conclude, I reiterate my opinion that it is a job of parents to teach children how to be good members of society, but it is also important that in some aspects teachers and the school also play their role in this process and make each child good citizens."
268,"

Movies are one of the most important means of entertainment in today’s world."
269," Many of the people believe that movies could be watched on phone rather than in cinema, while some believe that it more fun watching movies in cinema."
270, This essay will discuss on explore both the view with relevant examples.
271,"

During COVID times, everyone was instructed to stay home by initiating lockdown."
272, During this time most of the people found convenient watching movies on phones and also found it very cost effective option.
273,"  For example, Netflix, amazon have started releasing movies even before they got released in theater and you just need to pay subscription fee to watch movies."
274," Due to this people started spending more time with families, enjoying movies at home."
275, On other hand it also had disadvantages as it is making people use mobiles more often and also getting them restricted to their house.
276, Every individual should know the right usage of any application even when it is easily available.
277,"

One should also not forget the experience, movie watchers can have while watching movies in theatre in big screen."
278," Also, theatre provide great sound system which makes us feel the movie more real and they have wide range of facilities."
279," For example, the theater near my house provides options of different cuisine dishes and can be brought prepared to your seat without needing you to wait at counter."
280, Recently there has been a lot of increase in cost for food and tickets at few locations.
281, The people should find right options while choosing the cinema halls and not go overboard spending too much to watch a film.
282,"

Despite the convenience, experience plays more important role in watching movies."
283, This essay has discussed on how movies are being watched on phone or tablets and how few find it more interesting to watch movies in movie halls.
284," In my opinion, I would say theaters are the best option to enjoy the movie."
285,"

In this modern world, people are so busy in their own life that they hardly interact with their neighbours."
286, Sometimes they don’t even know the name of the people living close to them.
287," There could be many reasons for these, one of them could be their busy life."
288," Notwithstanding, the disclosure delves into these vantage points, and subsequently will explain why I think so."
289,"

Firstly, I think people are socializing less with the families living nearby."
290, The reasons could be their hectic job schedule.
291," Because everyone is so involved in their jobs, that they hardly get to spend the time with their spouse or kids."
292," For instance, I have a friend who works in a particular company, and his work schedule is at least 10 hours per day for 6 days a week."
293," And, that’s why they try to spend the time with their children, and not with their neighbours."
294," Conversely , in past, people invest their time meeting others because there was no means of distraction such as phones, computers etc."
295,"

In order to solve this, I think families should leave in an environment where there is more interaction with the families living in their proximity."
296," For these ,society apartments could be the best place where the society members can arrange weekly or monthly social gatherings to get to know everyone better."
297,"  For example, in the society I live in, the society members send invitations to various events where everyone can come with their families and chill."
298," We get together in  groups and play games , eat together and chill."
299,"

In conclusion, I think people should give some time meeting  new people, and getting to know each other."
300," Also, in the current ,world there are so many gadgets which keep people interacting with other people."
301,"

Having a good friend is an absolute blessing of life, however the quality that defines a good friend have always been questioned."
302, It is often argued that whether friends should have a similar perspective towards almost everything or having different opinions from time to time between friends brings more benefits.
303," This essay will outline why some people believe that it is necessary to have healthy arguments with friends, but why it is better to have friends who can agree with each other."
304,"

It is feasible to believe that disagreements between friends can play a role in regard to personal growth."
305," To be more specific, while people argue about different opinions, they can learn new perspectives, knowledge and ideas."
306," That is to say, if people have friends that one have a different opinion to another, it will result in having nourishing discussions and benefit each other to grow more."
307, So people have sufficient reasons to insist that having friends with different thoughts is beneficial.
308,"

However, the quality of friends does consist in neither personal improvement nor obtaining more knowledge, it is close to mental support."
309," To explain, people can learn knowledge and acquire different views of  life or subjects from other options such as a teacher, a colleague, the internet."
310, However they are not able to replace the role of a friend which is being next to each other and support with heart.
311," Therefore, it is of paramount importance for friends to have similar opinions to rely on each other."
312,"

In conclusion, there are definitely some advantages from being friends with someone whose opinion differs from another, as it could light up to new views of any matters and prevent from staying in closed thoughts."
313," Nevertheless, it is essential to remember that friends are there to support each other mentally not educationally."
314," Thus, the quality of good friends is subject to being friendly and supportive rather than being against one another."
315,"

Currently, people consider food is getting simple and easy to prepare."
316," However, this change will affect everyone daily life."
317," In my opinion, I believe that sometimes it is easy to cook."
318," Alternatively, instant packaging food might influence our health in the future."
319,"

Firstly, consuming some food in the supermarket is the best way when everybody has a busy life."
320, They can eat very quickly.
321," Also, it saves time for cooking."
322," To illustrate this, every parent has to work every day."
323, They need to prepare some meals for themselves or their children.
324, Instant noodles or a food can will be a good option.
325," As a result, they do not need to spend time too much for shopping the recipe and thinking of all ingredients."
326,"

Secondly, there are many new flavours of some food."
327, Some people enjoy having various tastes.
328, Different people have different eating styles.
329," For example, children like taking fresh seafood, meat, and snacks."
330, They will feel happy without any concern and can eat more and more.
331," Hence, the more new food, the more children love."
332,"

Nevertheless, not every food is good for health."
333, There are a lot of concerns about the ingredients in some meals.
334, Consumers always ignore what is this food contains.
335, This behaviour will make them sick afterwards.
336," So, food is essential for everyone, but they need to be careful."
337,"

In conclusion, the change in food affects people life."
338," Not only make them have easy cooking but also, they can enjoy the various taste of food."
339," Although, some food is bad for their health."
340," Consequently, there are both advantages and disadvantages to taking meals."
341, Everybody will find a way to make them feel worth eating.
342,"

The main problem causing traffic jams is too many cars."
343, There are lots more cars these days.
344,"0

It depends on your dataset and the number of features."
345," But generally, the best way to feature selection is Matrix covariance and histogram and feature methods such as PCA and chi Score and lasso, etc and machine learning model to select the best features, like Random Forest."
346,"

In order to your question, one way is normalized all Pearson coefficient scores results from 0 to 1 or score sorting of feature selection methods (like PCA)."
347, Then cluster the scores by K-mean or DB-Scan.
348, The class with minimum scores should be reviewed.
349, The minimum scores on the weak class generally should be dropped carefully with trial and error by machine learning method test.
350, If the accuracy goes up(without overfitting) it means you are right.
351,"



  About three years ago in July , I decided to travel to northwest Iran after spending a hot month."
352, The area calls Arasbaran.
353, The mountain Forrest is located in the vast area of south Azerbaijan and I had chosen it because of its exceptional vegetation.
354, I traveled on my own.
355," When I arrived at kalibar I had a rest for a night and after walking to the forest, there weren’t a few cars on the road."
356," Fortunately, a car got me near the forest, unlike Tehran, the weather was delightful and a cold fog surrounded the sky."
357," I reached the exceptional place with amazingly vegetation, some tall old cedar, and oak trees that covered the way of the sky in my eyes, the protected area with some rare species like Maral that, one of them passed on next to me."
358, After almost four hours I was so tired.
359," Fortunately, I arrived at an entertainment area named Ainallo so, I got a rest for a few moments and after eating local food got ready to back to the city."
360, It was a really exceptional vacation for me because I had no prediction for my travel along my journey so I faced some remarkable pretty scary moments.
361,"



  Social media access an easy and convenient medium to people to communicate and contact with each other, although like most other places there are some profiteer that want to attack by any way and I think it violate our privacy."
362,"

 Companies provide our personal information like our name, our location and personal interested."
363," In addition, they access to our behavior as a user and sometimes they share users “data without users “knowledge."
364," 

  Phishing is a common way that criminal attempt to achieve their personal information in several ways like send an email or a text and exited people with sharing sensitive ways to hack their data” users."
365,"







   Some experts throughout the world looking at the technology instruments as a device for improving connection among the people and some of them have had against this opinion, personally I strongly believe the second idea and want to discuss about that to prove it."
366,"

Nowadays technological instruments have facilitated communication for most people across the world and all of them can keeping in touch together easily, it is considerable but notable part of people can’t use the internet correctly and it causes to make some problem in their health and in life

Firstly, there is a strange evidence which prove the harmful of using excessively the internet, there are some researches show that 60 percent of people using their smartphone around 8 hours a day, and this amount not only have incredibly impacts on physical health but also have reasonable effects on their mind, for example some dependence on such device like smartphone and facing some mental disease like addictive nature."
367,"

Secondly, because of the social network media, people rarely find opportunity to have meeting up face to face and online communication tools have become to the preferable device for connection, undoubtfully loneliness can be a significant implication of this decision and make feeling isolated from the society."
368," 

In conclusion, although technology have had an undeniable effect on speed up the communication, it is not a reasonable factor to this subject and would not effectively help to improve social communications

Recently, some research has indicated that working as a team can cause to improve the efficiency and intelligence, I want to discuss about that by some convincing evidence."
369," 

Firstly, in general working in a group causes to benefits variety range of talent and increasing the performance, in addition, the members as a group are able to resolve their problem with consolation and find their mistake."
370," for example, group of people who are gathering to resolve the question, can easer find resolve in comparison with in isolation."
371,"

Secondly, working as a team is induced a sense of belonging among the members and causes to increase their motivation, in addition any part of group can discuss their ideas as an individual and participated effectively."
372,"

In conclusion, I undoubtedly agree working as group can improve intellectual skills however, it needs to more practical research to prove."
373,"



  Nowadays it is possible to carry a gun legally in some countries, it has become the controversial component in the world."
374," carrying weapons without enough research, would be hazardous to societies and leads to criminal happening."
375, In this essay I will clarify how it will be harmful and damage on people.
376,"

Firstly, it would be causes to make fear among the household especially due to use guns by some immature people who need to more control and maybe in violent situation make emotionally decision, for example, about 2 years ago, in Florida state, two young brothers killed several their classmate without any prevention and limitation by police or security people."
377,"

Secondly, lack of proper qualifications for gun ownership leads to gun access to the wrong persons and due to increased stealing and other criminal types, for instance in Florida amount of shoplifting had intensively grown in comparison to last years."
378,"

In conclusion, there are several evidence that having a gun in household should be harmful, so it is needs to impose more limitations and qualifications for carrying a gun and increasing safe environments."
379,"

  



Nowadays, computers are played inseparable roles in educational context, some people believe that it can be useful to progress of education, some others have adverse idea, in my opinion computers have made effective developing in learning and have led to improve the interaction among teachers and students."
380," In this essay I will give my ideas

Firstly, technology has provided widely access to internet all the globe and all learners can interact with each other remotely, by the way, it is providing up-to-minute information for researchers."
381,"

Secondly, the cost of textbook is likely to decrease if they are digitalized, it is considerably worthwhile for someone who can’t afford to pay income of tuition."
382,"  

In conclusion."
383," There are several evidence to confirm of reasonable advantages of Computers, we need to adopt ourselves to the new technology to make our life easier."
384,"



In some nations, traditions have shown extremely decrease in recent years, I think it happened because of technology and fast pace of life, I assert that parents and schools can be declaring that by spread enough awareness among the youth."
385," In this essay I will discuss about this topic

Firstly, because of technological device like gadgets and smartphones, adults seldom find any free time to their children and to nurture them, this is because parents have to extra work to provide enough money therefore there is not enough time to spend together

Secondly, most teenage prefer to spend their time with computer games rather than studying books or some cultural activities 

In conclusion, for keeping the tradition alive, parents and schools need more collaborate to save costume from being lost in addition parents have to allocate more time to their children









As Neural network (or other parametric machine learning) has got a lot of parameters, is there a mathematical way to find the best parameter?"
386,"
or Is there a computational way and how it works?"
387,"

Thanks for your answer



I saw you for the first time on linked in and saw your post that you became a grandmaster."
388, It is a great success I wish you all the best for the rest Data science journey.
389,"

Thankyou community for always responding and helping beginners like me ."
390,"

I just completed my linear and logistic alorithm , now i want to move towards decision tree or random forest ."
391, I dont have any knowledge about these both (random and decision) algorithms .
392," I wanna learn that now , what can u suggest , refer to noobs like me ?"
393," any notebook file , code , etc ."
394," it would be great if u can suggest me

I analysed and preprocessed the dataset,  and tested with famous classic machine learning."
